{
  "schema_version": 1,
  "conversation_id": "chat_approval_demo",
  "version": 8,
  "parent_version": 7,
  "scope": {
    "kind": "task",
    "target_id": "task_approval_demo"
  },
  "actor": {
    "role": "controller",
    "id": "task_controller"
  },
  "changes": [
    {
      "change_id": "approval_reference_push_branch_resolved",
      "kind": "approval.reference.updated",
      "content": {
        "approval_request_id": "approval_push_branch",
        "status": "resolved"
      },
      "propagate_to_descendants": false,
      "source_refs": [
        {
          "kind": "approval_request",
          "id": "approval_push_branch"
        }
      ]
    }
  ],
  "created_at": "2026-08-02T12:07:00Z"
}
